name,image,attribute,new_price,old_price,discount,installment,stars,count,r_count,reviews,characteristics,link
Кондиционер Hisense Wings 12 DC Inverter,https://cdn.asaxiy.uz/asaxiy-content/product/main_image/desktop/681de0e3ac5f6.jpg.webp,Standard,4219000,Unavailable,No discount,506 300 сум x 12 мес,5,В наличии,0,{},"{""Цвет"": ""Белые"", ""Вид"": ""Инверторные"", ""Low voltage"": ""Есть"", ""Уровень шума"": ""22 дБ(А)"", ""Режимы работы"": ""ОбогревОсушениеОхлаждениеРециркуляция"", ""Площадь"": ""35 кв.м"", ""Мощность"": ""12"", ""Гарантийный срок"": ""3 года"", ""Тип"": ""Сплит-система"", ""Тип установки внутреннего блока"": ""Настенные"", ""Страна производитель"": ""Китай"", ""Длина шланга/трубки"": ""3 м"", ""Тип хладагента (фреон)"": ""R32"", ""Страна происхождения"": ""Китай"", ""Класс энергопотребления"": ""A+"", ""Гарантия от производителя"": ""3 г"", ""Пульт дистанционного управления"": ""Есть""}",https://asaxiy.uz/product/kondicioner-hisense-wings-12-inverter
Кондиционер LG Artcool Dual Inverter Wi-Fi 24 (AC24BK),https://cdn.asaxiy.uz/asaxiy-content/product/main_image/desktop/63aaddbc9afa9.jpg,Скидка,13089000,13849000,6,1 570 700 сум x 12 мес,5,В наличии,0,{},"{""Цвет"": ""Черные"", ""Вид"": ""Инверторные"", ""Режимы работы"": ""ОбогревОхлаждениеРециркуляция"", ""Площадь"": ""72 кв.м"", ""Мощность"": ""24"", ""Гарантийный срок"": ""3 года"", ""Тип"": ""Сплит-система"", ""Тип установки внутреннего блока"": ""Настенные"", ""Тип хладагента (фреон)"": ""R32"", ""Класс энергопотребления"": ""A++ / A+"", ""Пульт дистанционного управления"": ""есть""}",https://asaxiy.uz/product/kondicioner-lg-artcool-dual-inverter-wi-fi-24-ac24bk
Кондиционер LG Artcool Dual Inverter Wi-Fi 18 (AC18BK),https://cdn.asaxiy.uz/asaxiy-content/product/main_image/desktop/63aadc9177933.jpg,Скидка,10449000,11209000,7,1 253 900 сум x 12 мес,2,В наличии,3,"{""Abduraxmanov Nurmuxammad Fazlitdinovich"": ""Кондиционер янги холатда келмади ташкиси очилган скочланган ичидеги нарсалариям чикмади умуман тавсия килмиман бу сайтни""}","{""Цвет"": ""Черные"", ""Вид"": ""Инверторные"", ""Режимы работы"": ""НочнойОбогревОхлаждениеРециркуляция"", ""Особенности"": ""С дисплеем"", ""Площадь"": ""60 кв.м"", ""Мощность"": ""18"", ""Гарантийный срок"": ""3 года"", ""Тип"": ""Сплит-система"", ""Тип установки внутреннего блока"": ""Настенные"", ""Тип хладагента (фреон)"": ""R32"", ""Класс энергопотребления"": ""A++"", ""Пульт дистанционного управления"": ""Есть""}",https://asaxiy.uz/product/kondicioner-lg-artcool-dual-inverter-wi-fi-18-ac18bk
Кондиционер LG Artcool Dual Inverter Wi-Fi 12 (AC12BK),https://cdn.asaxiy.uz/asaxiy-content/product/main_image/desktop/63aadbc037aba.jpg,Скидка,8079000,9349000,14,969 500 сум x 12 мес,5,В наличии,1,"{""Sobit Xudoyberdiyev"": ""Muddatli to'lovgayam bormi""}","{""Вид"": ""Инверторные"", ""Уровень шума"": ""19/41 дБ"", ""Режимы работы"": ""НочнойОбогревОсушениеОхлаждениеРециркуляция"", ""Площадь"": ""35 кв.м"", ""Мощность"": ""12"", ""Гарантийный срок"": ""3 года"", ""Тип"": ""Сплит-система"", ""Тип установки внутреннего блока"": ""Настенные"", ""Тип хладагента (фреон)"": ""R32"", ""Дополнительные режимы"": ""интенсивный (Turbo), ночной (Sleep)"", ""Класс энергопотребления"": ""A"", ""Пульт дистанционного управления"": ""Есть""}",https://asaxiy.uz/product/kondicioner-lg-artcool-dual-inverter-wi-fi-12
Карта памяти SanDisk Extreme Pro SDXC UHS Class 10 V30 200MB/s 64GB,https://cdn.asaxiy.uz/asaxiy-content/product/main_image/desktop/65c33e1eb23cc.jpg.webp,Standard,259000,Unavailable,No discount,71 900 сум x 4 мес,5,В наличии,0,{},{},https://asaxiy.uz/product/karta-pamyati-sandisk-extreme-pro-sdxc-uhs-class-10-v30-200mbs-64gb
"Внешний HDD Transcend 2TB StoreJet 25M3 2,5.",https://cdn.asaxiy.uz/asaxiy-content/product/main_image/desktop/63b6784a70ecc.png,ТОП,1159000,Unavailable,No discount,139 100 сум x 12 мес,5,В наличии,3,"{""Bekzod Sayidov"": ""Rahmat"", ""Shuxratjon Muxammadxonov Muzafarjon O‘g‘li"": ""No to'g'ri tanladim uzur товар полностью соответствует описанию""}","{""Технология"": ""HDD"", ""Тип жесткого диска"": ""Внешние""}",https://asaxiy.uz/product/vneshnij-hdd-transcend-2tb-25m3-2-5-kuot
Подставка для Ноутбука Borofone portable BH70,https://cdn.asaxiy.uz/asaxiy-content/product/main_image/desktop/63d4f87c26276.jpg.webp,Standard,99000,Unavailable,No discount,27 500 сум x 4 мес,5,В наличии,4,"{""Xurshidbek Maqsudaliyev Faxriddin O‘g‘li"": ""menga Juda yoqdi. rahmat katta!"", ""Aliqulov Avazbek Anzorovich"": ""легрофкада сал кочаркан лекин яхши махсулот"", ""Muhammadamin"": ""Aksiya qachongacha davom etadi ?"", ""Kayrat"": ""класс. Удобно""}","{""Вес"": ""220 г"", ""Размер"": ""44*260*27 мм""}",https://asaxiy.uz/product/podstavka-dlya-noutbuka-borofone-portable-bh70
"Переходник-адаптер MerKan, KT 168",https://cdn.asaxiy.uz/asaxiy-content/product/main_image/desktop/643e2e8c8cff5.jpg.webp,Standard,29200,Unavailable,No discount,8 200 сум x 4 мес,5,В наличии,0,{},"{""Страна происхождения"": ""Китай""}",https://asaxiy.uz/product/perehodnik-adapter-merkan-kt-168
"Внешний HDD Transcend 1TB StoreJet 25M3 2,5",https://cdn.asaxiy.uz/asaxiy-content/product/main_image/desktop/63b676c507f85.png.webp,Скидка,939000,959000,3,260 600 сум x 4 мес,5,В наличии,9,"{""O‘razbayev Qahhorbek Ozod O‘g‘li"": ""Zo’r"", ""JURAYEV JAVODBEK XASAN O‘G‘LI"": ""Zo’r ishlashi"", ""Fedya"": ""Kuchada 50$ silaga namuncha qimmat"", ""ABDUMALIK TURSUNOV RAVSHAN O‘G‘LI"": ""tovar kelmadi lekin sayta yetkazib berildi turipti zakaz 2 ta bolip qopti"", ""Abdumalik Tursunov Ravshan O‘g‘li"": ""assalomu aleykum buyurtmamni korib bering"", ""nurmatov ikromjon"": ""Muddatli tulovga tuldirildimi man muddatli tulovga olmoqchi edim"", ""Игорь"": ""Впервые купил usb-хард Transcend 1Tb 3 года назад и до сих пор им пользуюсь. Сегодня заказал ещё один, так как на прежнем не осталось памяти. Заказ оформнил утром, а доставили полчаса назад. Очень доволен оперативностью доставки. Спасибо большое"", ""Владимир"": ""Заказал 10 дней назад. Доставили через 2 часа после заказа. \r\nРаботает, никаких недостатков или достоинств не увидел. Скорости мне достаточно, хотя не замерял.""}","{""Технология"": ""HDD"", ""Тип жесткого диска"": ""Внешние""}",https://asaxiy.uz/product/vneshnij-hdd-transcend-1tb-25m3-2-5-hit-prodazh
Беспроводная мышь Metoo E0,https://cdn.asaxiy.uz/asaxiy-content/product/main_image/desktop/64953d05e57d0.jpg.webp,Standard,59000,Unavailable,No discount,16 400 сум x 4 мес,5,В наличии,1,"{""Jumayev Sanjar Ilyos O‘g‘li"": ""Yaxshi narx va ajoyib sifat""}",{},https://asaxiy.uz/product/besprovodnaya-mysh-metoo-e0se
Wi-Fi роутер TP-LINK TL-WR840N (Оптика),https://cdn.asaxiy.uz/asaxiy-content/product/main_image/desktop/5e15bca438224.jpg.webp,Standard,259000,Unavailable,No discount,71 900 сум x 4 мес,4,В наличии,26,"{""Akromjon Toxirov To‘lqinjon O‘g‘li"": ""Optika da ishledimi gponda"", ""Азим"": ""Мен Бир нарсага тушунмадим, роутер нега оптик толкали интернет учун день айтябсилару но узтелекомга Клаб булмайди день ёзгансизлар?"", ""ELBEK BOYMIRZAYEV MUXTOR O‘G‘LI"": ""Buyrtma umuman vaqtida yetib kelmas ekan. Men buyrtma berganimga 1 hafta boʻldi hali kelgani yoʻq, odamlarni bunaqa aldamanglar, 72 soat deb"", ""Husniddin"": ""Tenda 2 antenali router kuchlimi yoki 2 antenali tp link mi"", ""Javohir"": ""Uyga wifi simi kirgan oshanga ozimiz ulab qoysak ishlayverwdimi."", ""Shoxrux"": ""Здравствуйте роутер работает на вдсл"", ""Behruz"": ""Bu saytdagi mahsulotlarni telegram orqali sotib olsa boʻladimi."", ""anonim"": ""klentlarga to'lqi javob bermislami"", ""Азамат"": ""Этот роутер для оптики GPON подойдёт от Узтелеком? Что то я не нашел ответа на этот вопрос"", ""Некто"": ""У модема плохо работает WI FI сижу в зале, модем в спальне на ноуте постоянно прерывается интернет и падает скорость"", ""Ezozbek Sirojov Qodir O'g'li"": ""bu router optika uchun mo'jallanganmi"", ""James Jrhgeg"": ""bu router telfon linasiga ulanadimi va nech kunda yetkizib beriladi buyurtma bergandan so'ng"", ""Mag‘rurbek"": ""Simni antenadan tortib keladimi yo o‘zini antenasi bormi"", ""Алишер"": ""Кўпроқ олганга чегирмалар бериладими?"", ""Asanovnurgali"": ""Opkep simlarini xam ozlari opkep beradimi opshi qancha"", ""Abbosxon Axmadxo‘jayev Akmalxon O‘g‘li"": ""Maxsulotlarni xarakteristikasini oʻzbek tilida ham kiritinglar. Oʻzbekiston respublikasida eng koʻp aholi oʻzbeklar🤨🤨🤨"", ""Salohiddin"": ""Viloyatlagayam dostavka bormi"", ""Jamshid"": ""Sim karta bilan ishlaydigani bormi? Narxi qancha. Biz taraflarda telefon liniyasi yuq"", ""azizov_755"": ""Optik tolaliga tushmidiku bula gipon texnalogiyasi yoku buni bu optika diylmidi yaxshilab oʻrganib kegin qoʻyila mahsulotlani"", ""Parviz"": ""Radiusi nechi metr ekan bilganlar yozsin iltimos"", ""Толиб"": ""Ишлаши яхши. Лекин, уч хонали квартирага кичиклик қиларкан. Агар квартира катта бўлса, яхшиси учта антеналик олинг.\r\n\r\nДоставка икки кунда келди, шуни тезлаштирса яхши бўлади."", ""Алексей"": ""Купил два данных роутера , себе и родителям, пока все устраивает и работает очень хорошо."", ""Виталий"": ""стоял раньше Он лайм роутер постоянно проблемы были думали интернет, поставили этот роутер все наладилось, 50 2м покрывает без проблем, посмотрим на сколько хватит"", ""Jalol"": ""UzOnline optika u4un qo'ydik. Ishlashi zur. 20 MB skoros 2 xona kvartirada ishlavotti. 4 soatda obkeliwdi."", ""Сергей"": ""Отзывов мало о нем. Но посмотрев его характеристики и цену, я решил, зачем переплачивать за другие если в этом есть всё что нужно. Мощный 2х антенный сигнал, функционал больше чем я ожидал. Дизайн классный. Цена отличная. Смысла брать другие не вижу..""}",{},https://asaxiy.uz/product/wi-fi-router-tp-link-tl-wr840n-optika-hit-prodazh
"Внешний HDD Transcend 4TB 25H3 2,5 USB 3.0",https://cdn.asaxiy.uz/asaxiy-content/product/main_image/desktop/63aebd505183b.jpg,ТОП,1749000,Unavailable,No discount,209 900 сум x 12 мес,5,В наличии,3,"{""XUSANOV ODIL YAXSHIBOYEVICH"": ""Mahsulat yaxshi ekan kungildagidek lekin yitib kelishi kechikdi, qayerda kelayotgani ham aniq kuzatib boʻlmas ekan"", ""Sunnatillo Rustamov Rustamovich"": ""Assalomu aleykum 2 tb nechi pulga aylanadi 12 oyga"", ""Firuz"": ""Transcend 4tb kreditga 12 oyga necha puldan töĝri keladi""}",{},https://asaxiy.uz/product/vneshnij-hdd-transcend-4tb-25m3-2-5-kuot-usb-3-0
Кабель Borofone USB на USB Type-C BX51 Triumph 3.0A 1м (Черный),https://cdn.asaxiy.uz/asaxiy-content/product/main_image/desktop/67544f2866ce7.jpg.webp,Standard,17000,Unavailable,No discount,4 800 сум x 4 мес,5,В наличии,0,{},"{""Размер"": ""1 metr"", ""Гарантийный срок"": ""1 месяц"", ""Страна происхождения"": ""Китай""}",https://asaxiy.uz/product/kabel-dlya-borofone-bx51-type-c1m
Клавиатура и мышь T-Wolf TF200 USB,https://cdn.asaxiy.uz/asaxiy-content/product/main_image/desktop/5f746bc66e68e.jpg.webp,Standard,169000,Unavailable,No discount,46 900 сум x 4 мес,4,,7,{},{},https://asaxiy.uz/product/klaviatura-i-mysh-t-wolf-tf-200-usb-white
"Ноутбук Acer Aspire 3 A315-59 / i5-1235U / DDR4 8GB / SSD 512GB / 15.6"" Pure Silver.",https://cdn.asaxiy.uz/asaxiy-content/product/main_image/desktop/65d0389c1926b.jpg.webp,Скидка,4819000,5689000,16,578 300 сум x 12 мес,5,В наличии,0,{},"{""Процессор"": ""Intel Core i5"", ""Объем ОЗУ"": ""8 ГБ"", ""Вес"": ""1.78 кг"", ""Цвет"": ""Стальной"", ""Тип накопителя"": ""SSD"", ""Класс"": ""Для офисаДля учебыДля бизнесаДля несложных задач"", ""Модель"": ""A315-59"", ""Размер"": ""17.90 x 362.9 x 241.3 мм"", ""Бренд графического процессора"": ""Iris Xe Graphics"", ""Картридер"": ""без кардридер"", ""Тип матрицы"": ""IPS"", ""Видеокарта"": ""Intel Iris Xe Graphics"", ""Диагональ экрана"": ""15-15.6\"""", ""Тип устройства"": ""Ноутбук"", ""Время автономной работы"": ""6,5 часов"", ""Покрытие экрана"": ""Матовое покритые"", ""Гарантийный срок"": ""1 год"", ""Бренд процессора"": ""Intel"", ""Число портов USB"": ""3x USB 3.2 Gen 1 Type-A Ports"", ""Модуль связи WiFi"": ""IEEE 802.11ac Bluetooth 5.0"", ""Разрешение экрана"": ""1920x1080 Full HD"", ""Серия процессора"": ""Intel Core i5"", ""Число портов HDMI"": ""1x HDMI 1.4"", ""Оптический привод DVD"": ""нет"", ""Макс. частота обновления, Гц"": ""60 ГЦ"", ""Частота процессора, ГГц"": ""до 4.7 ГГц"", ""Емкость аккумулятора"": ""Integrated Li-Polymer battery 48 Whr"", ""Интерфейсы и разъемы"": ""HDMIUSB 3.0"", ""Подсветка клавиатуры"": ""Нет"", ""Технология матрицы"": ""TN"", ""Предустановленная ОС"": ""Без ОС"", ""Страна происхождения"": ""Китай"", ""Модуль связи Bluetooth"": ""Есть"", ""Объем накопителя (HDD/SSD)"": ""512 ГБ"", ""Производитель видеокарты"": ""Intel"", ""Тип оперативной памяти"": ""DDR4"", ""Частота обновления экрана"": ""60 Гц""}",https://asaxiy.uz/product/noutbuk-acer-aspire-3-a315-59-i5-1235u-ddr4-8gb-ssd-512gb-156-pure-silver
Ноутбук Apple MacBook Air 15 M3 16GB/512GB Space grey,https://cdn.asaxiy.uz/asaxiy-content/product/main_image/desktop/679662813d5ea.webp,Скидка,19499000,24919000,22,2 339 900 сум x 12 мес,5,В наличии,0,{},"{""Объем ОЗУ"": ""16 ГБ"", ""Вес"": ""1.24 kg"", ""Тип накопителя"": ""SSD"", ""Класс"": ""Для офисаДля учебыДля бизнесаДля графикиДля геймеровУниверсальныеДля программирования"", ""Размер"": ""215*304*11.3 mm"", ""Бренд графического процессора"": ""10-ядерный графический процессор"", ""Картридер"": ""без кардридер"", ""Количество ядер процессора"": ""8"", ""Тип матрицы"": ""IPS"", ""Видеокарта"": ""Apple graphics 8-core"", ""Диагональ экрана"": ""15-15.6\"""", ""Тип устройства"": ""НоутбукУльтрабук"", ""Время автономной работы"": ""До 15 часов беспроводного интернета"", ""Гарантийный срок"": ""1 год"", ""Материал корпуса"": ""Металл"", ""Бренд процессора"": ""Apple"", ""Число портов USB"": ""MagSafe 3 порта // 3,5 мм разъем для наушников // Два порта Thunderbolt/USB 4"", ""Модуль связи WiFi"": ""Wi-Fi 6E (802.11ax) + Bluetooth 5.3"", ""Разрешение экрана"": ""больше Full HD"", ""Серия процессора"": ""Apple M3"", ""Число портов HDMI"": ""без HDMI"", ""Оптический привод DVD"": ""нет"", ""Емкость аккумулятора"": ""Литий-полимерный аккумулятор емкостью 66,5 Вт‑ч"", ""Интерфейсы и разъемы"": ""USB 3.03.5 мм"", ""Подсветка клавиатуры"": ""Да"", ""Технология матрицы"": ""IPS"", ""Предустановленная ОС"": ""Mac OS"", ""Особенности ноутбуков"": ""МиниМощныеКомпактныеС подсветкой клавиатурыСо сканером отпечатков пальцев"", ""Модуль связи Bluetooth"": ""Есть"", ""Разрешение Web-камеры"": ""HD-камера FaceTime 1080p с тремя микрофонами"", ""Объем накопителя (HDD/SSD)"": ""512 ГБ"", ""Производитель видеокарты"": ""Apple"", ""Тип оперативной памяти"": ""LPDDR5""}",https://asaxiy.uz/product/noutbuk-apple-macbook-air-15-m3-16gb512gb-space-grey
Ноутбук Apple MacBook Air 13 M1 8/256 Gray,https://cdn.asaxiy.uz/asaxiy-content/product/main_image/desktop/6353dce663d22.jpg.webp,Standard,9559000,Unavailable,No discount,1 147 100 сум x 12 мес,5,В наличии,11,"{""Abbos Toshxojayev"": ""Нега буюртма кеч қолмоқда"", ""Sirojbek Maqsudov"": ""chegirma qancha vaqt davom qiladi?"", ""Baxtiyor Chorshanbiyev"": ""Talabar uchun 17%lik chegirma hozir ham mavjudmi?"", ""Bashirillayev Sirojiddin"": ""Assalomaleykum uzum nasiya orqali muddatli to'lovga olsam bo'ladimi?"", ""Saidnazarov Shohruhhon Sardorbek O‘g‘li"": ""Talabaraga 17% chegirma macbook da ham iwlidimi"", ""MURODILLOYEV OG‘ABEK IBODILLO-O‘G‘LI"": ""Yaxshi"", ""Shakhzod"": ""Muddatli to'lovga yana chiqarasizlarmi?"", ""Алишер Тогоев Каримович"": ""Muddatli to’lovga olsa boladimi"", ""Shuhrat"": ""Klaviaturasi orqa tarafdan yonadimi"", ""Asilbek Jahonov"": ""Ajoyib noutbuk. Intel noutbuklariga nisbatan ancha yaxshi ishlaydi""}","{""Объем ОЗУ"": ""8 ГБ"", ""Тип накопителя"": ""SSD"", ""Класс"": ""Для офисаДля учебыУниверсальныеДля несложных задач"", ""Количество ядер процессора"": ""8"", ""Видеокарта"": ""Apple graphics 7-core"", ""Диагональ экрана"": ""13\"""", ""Цвет товара"": ""Серый"", ""Тип устройства"": ""Ультрабук"", ""Гарантийный срок"": ""1 год"", ""Материал корпуса"": ""Алюминий"", ""Бренд процессора"": ""Apple"", ""Число портов USB"": ""2"", ""Разрешение экрана"": ""больше Full HD"", ""Серия процессора"": ""Apple M1"", ""Оптический привод DVD"": ""нет"", ""Подсветка клавиатуры"": ""Да"", ""Предустановленная ОС"": ""Mac OS"", ""Особенности ноутбуков"": ""МиниКомпактныеС подсветкой клавиатуры"", ""Страна происхождения"": ""Китай"", ""Модуль связи Bluetooth"": ""Есть"", ""Объем накопителя (HDD/SSD)"": ""До 320 ГБ"", ""Производитель видеокарты"": ""Apple"", ""Частота обновления экрана"": ""60 Гц""}",https://asaxiy.uz/product/apple-macbook-air-133-touch-m1-8256
"Принтер Epson L3250 (МФУ 3в1, А4, струйный, цветной).",https://cdn.asaxiy.uz/asaxiy-content/product/main_image/desktop/63f889f909374.jpg.webp,ТОП,2429000,Unavailable,No discount,404 900 сум x 6 мес,5,В наличии,7,"{""Azamat Sa’dullayev Nafiddinovich"": ""Kompyuterga ulaydigan kabel yo'q deyilibti izohda lekin tavsifda bor deyilganku? Shu masalaga oydinlik kiritaylik olmoqchi edim hozir? Bozorga borishga vaqt yoq alohida kabel uchun!"", ""Alisher Boltaboyev Baxtiyor O‘g‘li"": ""kampyuterga ulaydigan kabeli chiqmadi. buyurtma bersangiz shu joyini inobatga oling. alohida sotib olasiz"", ""Karimjon Abdullayev"": ""Zo'r ekan."", ""Arslonbek Dexkanov"": ""Assaloma leykum dasturchilar uchun foizsiz kredit ajratiladi.  Shu kreditni bank hisobraqamga tushirib berishi uchun sizlardan shu printerni harid qilishim to`g`risida shartnoma kerak . Sizlar shunday shartnoma bera olasizlarmi"", ""Sardor"": ""рассрочкага сотиладими?"", ""Tolmas Yangiboyev Toji O‘g‘li"": ""Nechta list chiqarishiga garantiya?""}","{""Вес"": ""3.9 кг"", ""Размер"": ""ШхВхГ 37,5х17,9х34,7 см"", ""Гарантийный срок"": ""1 год"", ""Страна происхождения"": ""Китай""}",https://asaxiy.uz/product/printer-epson-l3250-mfu-3v1-a4-struynyy-cvetnoy
