name,image,attribute,new_price,old_price,discount,installment,stars,count,r_count,reviews,characteristics,link
Смартфон HONOR 400 8/256GB Midnight Black,https://cdn.asaxiy.uz/asaxiy-content/product/main_image/desktop/68613cccc341f.webp,Standard,5549000,Unavailable,No discount,462 500 сум x 12 мес,5,В наличии,4,"{""Ziyoda"": ""judayam zor telefon narxiga arziydi tafsiya qilaman ⭐⭐⭐⭐⭐"", ""GERA 47"": ""Мобила отличная, мне понравился."", ""Zayniddin"": ""Zor"", ""Shaxram Gadayev Zokirjon O‘g‘li"": ""Ассаламу алейкум имейка килиш керакми?""}","{""Вес"": ""184 г"", ""Аудио"": ""Стереодинамики, поддержка Hi‑Res Audio, технология шумоподавления (Voice Care)"", ""Видео"": ""Запись 4K при 30–60 кадр/с (особенно основная камера поддерживает видео высокого разрешения)"", ""Цвет"": ""Чёрный"", ""Размер"": ""156.5 × 74.6 × 7.3 мм"", ""Диагональ экрана"": ""6.55"", ""Тип экрана"": ""AMOLED"", ""Версия ОС"": ""MagicOS 9.0 на базе Android 15"", ""Коммуникации"": ""GPSNFCQZSSA-GPSWi-FiBeidouDualGPSGLONASSBluetooth"", ""Форм-фактор"": ""Моноблок"", ""Изображения"": ""AMOLED"", ""Особенности"": ""4GBluetoothС камеройС фонарикомС большим экраномС мощной батареей"", ""Стандарт Wi-Fi"": ""802.11 a/b/g/n/ac/ax/be (реально поддерживается Wi‑Fi 6E)"", ""Тип SIM-карты"": ""Nano‑SIM / eSIM"", ""Модель"": ""HONOR 400"", ""Стандарт связи"": ""3G4G5G"", ""Видеопроцессор"": ""Qualcomm Adreno 720"", ""Гарантийный срок"": ""1 год"", ""Основная камера"": ""200 MP основная (f/1.9, OIS + EIS),"", ""Разрешение фронтальной камеры"": ""50 MP (портретная съёмка, AI обработка)"", ""Выход на наушники"": ""USB‑C"", ""Встроенная память"": ""256 ГБ"", ""Оперативная память"": ""8 ГБ"", ""Процессор"": ""Qualcomm Snapdragon 7 Gen 3 (SM7550‑AB, 4 нм)"", ""Количество SIM-карт"": ""2"", ""Особенности смартфон"": ""ИгровыеС фонарикомС гироскопомНа 2 сим картыС автофокусомC макрообъективомС тройной камеройВодонепроницаемыеС быстрой зарядкойС голосовым управлениемС разблокировкой по лицуС широкоугольным объективомСо сканером отпечатка пальцевС ультраширокоугольным объективом"", ""Макс. разрешение видео"": ""4K UHD (до 60 fps)"", ""Количество основных (тыловых) камер"": ""2"", ""Слот для карт памяти"": ""-"", ""Беспроводные интерфейсы"": ""Wi‑Fi 6/6E (Wi‑Fi 7 формально), Bluetooth 5.4, NFC, IR"", ""Емкость аккумулятора"": ""6000 мА*ч и более"", ""Основные (тыловые) камеры"": ""200 MP (f/1.9, OIS), 12 MP (112°, макро)"", ""Поддержка диапазонов LTE"": ""Основные LTE и 5G, VoLTE поддержка"", ""Макс. частота кадров видео"": ""60 fps при 4K UHD"", ""Количество ядер процессора"": ""8"", ""Точный объём аккумулятора"": ""6000 мАч"", ""Операционная система"": ""Android""}",https://asaxiy.uz/product/smartfon-honor-400-8256gb-midnight-black
Смартфон iPhone 16 Pro Max 256GB  2 SIM (Sim+eSim) Desert Titanium,https://cdn.asaxiy.uz/asaxiy-content/product/main_image/desktop/66eeb4d440ffe.webp,Супер цена,18099000,19169000,6,2 202 100 сум x 12 мес,5,В наличии,1,"{""Lochinbek"": ""yaxshi""}","{""Вес"": ""227 г"", ""Аудио"": ""AAC, APAC, MP3, Apple Lossless, FLAC, Dolby Digital, Dolby Digital Plus и Dolby Atmos."", ""Видео"": ""HEVC, H.264, AV1 и ProRes. HDR с Dolby Vision, HDR10+/HDR10 и HLG"", ""Цвет"": ""Золотистый"", ""Размер"": ""163*77.6*8.25 мм"", ""Диагональ экрана"": ""6,5''–6,9''"", ""Тип экрана"": ""Super Retina XDR"", ""Версия ОС"": ""iOS 18"", ""Коммуникации"": ""GPSQZSSNavICWi-FiBeidouGALILEOGLONASSiBeaconBluetooth"", ""Особенности"": ""4GBluetoothС камеройС большим экраномС мощной батареей"", ""Стандарт Wi-Fi"": ""802.11ax"", ""Тип SIM-карты"": ""nano-SIM + eSIM"", ""Модель"": ""iPhone 16 Pro Max"", ""Стандарт связи"": ""3G4G5G"", ""Видеопроцессор"": ""Neural Engine"", ""Гарантийный срок"": ""1 год"", ""Разрешение фронтальной камеры"": ""12 МП"", ""Выход на наушники"": ""USB Type-C"", ""Процессор"": ""Apple A18 Pro"", ""Количество SIM-карт"": ""2"", ""Особенности смартфон"": ""С e-simИгровыеС фонарикомС барометромС гироскопомНа 2 сим картыС автофокусомC макрообъективомС тройной камеройВодонепроницаемыеС беспроводной зарядкойС разблокировкой по лицуС широкоугольным объективомС ультраширокоугольным объективом"", ""Встроенная память"": ""256 ГБ"", ""Макс. разрешение видео"": ""1320 x 2868"", ""Страна происхождения"": ""Китай"", ""Количество основных (тыловых) камер"": ""3"", ""Слот для карт памяти"": ""нет"", ""Беспроводные интерфейсы"": ""bluetooth, nfc, wi-fi"", ""Емкость аккумулятора"": ""3355 мАч"", ""Основные (тыловые) камеры"": ""48 МП + 12МП + 48 МП"", ""Частота кадров при записи видео 4K"": ""24/25/30/60 кадров в секунду"", ""Поддержка диапазонов LTE"": ""2G/3G/4G LTE/5G"", ""Количество ядер процессора"": ""6"", ""Частота кадров при записи видео Full HD"": ""25/30/60 кадров в секунду"", ""Операционная система"": ""iOS""}",https://asaxiy.uz/product/smartfon-iphone-16-pro-max-esim-256gb-desert-titanium-s-2-zaregistrirovannym-imei
Смартфон Samsung Galaxy S25 Ultra 12/256 ГБ Черный титан,https://cdn.asaxiy.uz/asaxiy-content/product/main_image/desktop/67935c5861525.png.webp,Супер цена,14419000,15339000,6,1 754 400 сум x 12 мес,5,В наличии,4,"{""Lochinbek"": ""narxi qimmat ekan"", ""Sardorbek Abdimajidov"": ""Товар полностью соответствует описанию"", ""Sardorbek Abdimajidov Mirzarayim O‘g‘li"": ""Kafolat muddati 1 yilmi ?""}","{""Вес"": ""218 г"", ""Аудио"": ""3GA, AAC, AMR, APE, AWB, DFF, DSF, FLAC, IMY, M4A, MID, MIDI, MP3, MXMF, OGA, OGG, OTA, RTTTL, RTX, WAV, XMF"", ""Видео"": ""MP4, M4V, 3GP, 3G2, AVI, FLV, MKV, WEBM"", ""Цвет"": ""Чёрный"", ""Размер"": ""162,8 x 77,6 x 8,2"", ""Диагональ экрана"": ""6.9\"""", ""Тип экрана"": ""Dynamic AMOLED 2X"", ""Версия ОС"": ""Android 15 с One UI 7"", ""Коммуникации"": ""GPSNFCQZSSA-GPSWi-FiBeidouGALILEOGLONASSiBeaconBluetooth"", ""Форм-фактор"": ""Моноблок"", ""Изображения"": ""2992x2992, 4000x1848, 4000x2250, 4000x3000, 8160x6120, 16320x12240"", ""Особенности"": ""4GBluetoothС камеройС большим экраномС мощной батареей"", ""Стандарт Wi-Fi"": ""Wi-Fi Direct, Wi-Fi Hotspot"", ""Тип SIM-карты"": ""Nano-SIM, eSIM"", ""Модель"": ""Samsung Galaxy S25 Ultra"", ""Стандарт связи"": ""3G4G5G"", ""Видеопроцессор"": ""AI ProVisual Engine"", ""Гарантийный срок"": ""1 год"", ""Основная камера"": ""200+50+50+10 Мп"", ""Разрешение фронтальной камеры"": ""12 МП"", ""Выход на наушники"": ""USB Type-C"", ""Встроенная память"": ""256 ГБ"", ""Оперативная память"": ""12 ГБ"", ""Процессор"": ""Qualcomm Snapdragon 8 Elite for Galaxy"", ""Количество SIM-карт"": ""2"", ""Особенности смартфон"": ""С e-simИгровыеС компасомС барометромС гироскопомНа 2 сим картыЧетыре камерыВодонепроницаемыеС быстрой зарядкойС реверсивной зарядкойС беспроводной зарядкойС разблокировкой по лицуС цифровой стабилизациейС широкоугольным объективомСо сканером отпечатка пальцевС ультраширокоугольным объективом"", ""Макс. разрешение видео"": ""Full HD, HD, Ultra HD 4K, Ultra HD 8K"", ""Страна происхождения"": ""Вьетнам"", ""Количество основных (тыловых) камер"": ""4"", ""Слот для карт памяти"": ""нет"", ""Емкость аккумулятора"": ""5000 мА*ч"", ""Основные (тыловые) камеры"": ""200+50+50+10 Мп"", ""Поддержка диапазонов LTE"": ""FDD-LTE 700 (B12), FDD-LTE 700 (B13), FDD-LTE 700 (B17), FDD-LTE 700 (B28), FDD-LTE 800 (B20), FDD-LTE 850 (B5), FDD-LTE 850 (B18), FDD-LTE 850 (B19), FDD-LTE 850 (B26), FDD-LTE 900 (B8), FDD-LTE 1700 (B4), FDD-LTE 1700 (B66), FDD-LTE 1800 (B3), FDD-LTE 1900 (B2), FDD-LTE 1900 (B25), FDD-LTE 2100 (B1), FDD-LTE 2600 (B7), TDD-LTE 1900 (B39), TDD-LTE 2300 (B40), TDD-LTE 2500 (B41), TDD-LTE 2600 (B38)"", ""Макс. частота кадров видео"": ""1280x720 (30 кадр./сек.), 1920x1080 (30 кадр./сек.), 1920x1080 (60 кадр./сек.), 1920x1080 (120 кадр./сек.), 1920x1080 (240 кадр./сек.), 3840x2160 (30 кадр./сек.), 3840x2160 (60 кадр./сек.), 3840x2160 (120 кадр./сек.), 7680x4320 (30 кадр./сек.)"", ""Количество ядер процессора"": ""8"", ""Точный объём аккумулятора"": ""5000 мА*ч"", ""Операционная система"": ""Android""}",https://asaxiy.uz/product/samsung-galaxy-s25-ultra-256-gb-chernyy-titan
Смартфон Honor 400 Pro 12/512GB Midnight Black,https://cdn.asaxiy.uz/asaxiy-content/product/main_image/desktop/68612751d7e90.png.webp,Standard,8999000,Unavailable,No discount,750 000 сум x 12 мес,5,В наличии,6,"{""Atamuratov Farxod Nasriddinovich"": ""Honor 400 pro olaman deganlar uchun ushbu blogerni ko`ring Павел Хмурчик"", ""No‘’monov Nasimjon Nozim O‘g‘li"": ""Zo'r"", ""Sherzod"": ""Yaxshi telefon"", ""Abrorbek Bakhramov"": ""Telefonga gap yo'q hunqqa telefonni 9mlnga 0% 12 oyga bundan yaxshi taklif yo'q hozir bozorda. ishlashi tez sd8gen3 zwryad 100 wat 40minutda 100%. Ekranni sifati ham zo'r. Qo'lda turishi ham yaxshi. bitta 3.5mm headphone jet yo'qligi holos kamchiligi"", ""Akbarov Sarvar Kozimjonovich"": ""smartfon 2 kunda Farg'onaga yetib keldi. telefon sifati, kafolati, qutisi va qadog'iga gap yo'q! operatorlar xizmati ham juda tez va iste'molchini savollarini to'la qoniqtiradi. Tavsiya qilaman."", ""Maxammadiyev Ashurxon Zakirxonovich"": ""google pixel omoqchiman""}","{""Вес"": ""205 г"", ""Аудио"": ""стереодинамики, Hi‑Res Audio, Voice Care"", ""Видео"": ""запись 4K (на основной камере), AI-видео функции"", ""Цвет"": ""Чёрный"", ""Размер"": ""(Д × Ш × Т): 160,8 × 76,1 × 8,1 мм"", ""Диагональ экрана"": ""6,7"", ""Тип экрана"": ""AMOLED"", ""Версия ОС"": ""MagicOS 9 на базе Android 15"", ""Коммуникации"": ""GPSNFCA-GPSWi-FiDualGPSGLONASSBluetooth"", ""Форм-фактор"": ""Моноблок"", ""Изображения"": ""AMOLED"", ""Особенности"": ""4GBluetoothС камеройС фонарикомС большим экраномС мощной батареей"", ""Стандарт Wi-Fi"": ""802.11 a/b/g/n/ac/ax/be (Wi‑Fi 7/6E/6)"", ""Тип SIM-карты"": ""Nano‑SIM; поддержка eSIM"", ""Модель"": ""Honor 400 Pro"", ""Стандарт связи"": ""3G4G5G"", ""Видеопроцессор"": ""Qualcomm Adreno 750"", ""Гарантийный срок"": ""1 год"", ""Основная камера"": ""200 MP + 50 MP + 12 MP (AI)"", ""Разрешение фронтальной камеры"": ""50 MP + 2 MP сенсор глубины (f/2.0 / f/2.4)"", ""Выход на наушники"": ""Type‑C"", ""Встроенная память"": ""512 ГБ"", ""Оперативная память"": ""12 ГБ"", ""Процессор"": ""Snapdragon 8 Gen 3 (SM8650‑AB) 4 нм Octa-core: 1×3.3 GHz Cortex‑X4, 3×3.15 GHz Cortex‑A720, 2×2.96 GHz Cortex‑A720, 2×2.26 GHz Cortex‑A520"", ""Количество SIM-карт"": ""2"", ""Особенности смартфон"": ""С e-simИгровыеС фонарикомНа 2 сим картыС автофокусомC макрообъективомС тройной камеройВодонепроницаемыеС быстрой зарядкойС беспроводной зарядкойС голосовым управлениемС разблокировкой по лицуС цифровой стабилизациейС широкоугольным объективомСо сканером отпечатка пальцевС ультраширокоугольным объективом"", ""Макс. разрешение видео"": ""4K UHD (3840×2160 пикселей)"", ""Количество основных (тыловых) камер"": ""3"", ""Слот для карт памяти"": ""-"", ""Беспроводные интерфейсы"": ""Wi‑Fi 6/6E/7, Bluetooth 5.4, NFC, инфракрасный порт, USB‑C OTG, стереодинамики, Hi‑Res Audio"", ""Емкость аккумулятора"": ""6000 mAh"", ""Основные (тыловые) камеры"": ""200 МП (главная AI, f/1.9, OIS, 1/1.4\""), 50 MP телефото (f/2.4, 3× оптический зум, OIS), 12 MP ультраширокоугольная (112°, макро)."", ""Частота кадров при записи видео 4K"": ""60 fps"", ""Поддержка диапазонов LTE"": ""Поддержка LTE Cat20  (b1/2/3/4/5/8/19/28 и TD‑LTE b34/38/39/40/41), VoLTE, 5G SA/NSA (Bands 1/5/8/28/41/77/78)"", ""Макс. частота кадров видео"": ""60 fps при 4K UHD (основная камера)"", ""Количество ядер процессора"": ""8"", ""Точный объём аккумулятора"": ""6000 mAh"", ""Операционная система"": ""Android""}",https://asaxiy.uz/product/smartfon-honor-400-pro-12512gb-midnight-black
Смартфон Vivo X200 Pro 5G 12/256 Cosmos black,https://cdn.asaxiy.uz/asaxiy-content/product/main_image/desktop/67dd85969a678.jpg.webp,Скидка,11229000,11849000,6,1 366 200 сум x 12 мес,5,В наличии,5,"{"""": ""Assalomu alaykum, bunda IMEI roʻyxatdan oʻtkazilganmi? Yoki oʻtkazish kerak boʻladimi?"", ""Мирза Гаджи Мирзаев"": ""Здравствуйте. Проблем со связью нет? Все ли бенды поддерживает, которые есть в Узбекистане?"", ""Asror Musurmonov Na’farzoda"": ""это глобалка? или китайская версия?"", ""Kozimbek Kozimjonov"": ""Assalomu alaykum meni open da 5400000 som limitim bor va yana yonimda naqt pulim bor. Naqt pulimga harid qilib yetmagan joyiga opendagi limitimdan foydalansam buladimi""}","{""Вес"": ""223 г"", ""Аудио"": ""AAC, WAV, MP3, MIDI, VORBIS, APE, FLAC"", ""Видео"": ""MP4; 3GP; AVI; FLV; MKV; WEBM; TS; ASF"", ""Цвет"": ""Чёрный"", ""Размер"": ""162,36 × 75,95 × 8,20 мм"", ""Диагональ экрана"": ""6,78″"", ""Версия ОС"": ""Funtouch OS 15"", ""Коммуникации"": ""GPSNFCQZSSWi-FiBeidouGALILEOGLONASSBluetooth"", ""Форм-фактор"": ""Моноблок"", ""Особенности"": ""4GBluetoothС камеройС фонарикомПротивоударныеС мощной батареей"", ""Стандарт Wi-Fi"": ""802.11ac"", ""Тип SIM-карты"": ""nano sim"", ""Стандарт связи"": ""3G4G5G"", ""Видеопроцессор"": ""Immortalis-G925"", ""Гарантийный срок"": ""1 год"", ""Основная камера"": ""50 МП + 50 МП + 200 МП"", ""Выход на наушники"": ""Type-C"", ""Процессор"": ""MediaTek Dimensity 9400"", ""Количество SIM-карт"": ""2"", ""Особенности смартфон"": ""С FM-радиоС фонарикомНа 2 сим картыС разблокировкой по лицу"", ""Встроенная память"": ""256 ГБ"", ""Страна происхождения"": ""Китай"", ""Количество основных (тыловых) камер"": ""3"", ""Беспроводные интерфейсы"": ""Bluetooth, Wi-Fi"", ""Емкость аккумулятора"": ""6000 мА*ч и более"", ""Поддержка диапазонов LTE"": ""2G, 3G, 4G LTE 5G"", ""Количество ядер процессора"": ""8 (Octa-core)"", ""Точный объём аккумулятора"": ""6000 мАч"", ""Оперативная память"": ""12 ГБ"", ""Операционная система"": ""Android""}",https://asaxiy.uz/product/smartfon-vivo-x200-pro-5g-12256-cosmos-black
Смартфон Xiaomi Redmi Note 14 Pro 8/256GB Midnight Black,https://cdn.asaxiy.uz/asaxiy-content/product/main_image/desktop/6787ad7fdf19d.jpg.webp,Супер цена,3339000,3919000,15,406 300 сум x 12 мес,4,В наличии,7,"{""Tojiqulov Minavvar Muhiddin O‘g‘li"": ""buni kim hal qiladi"", ""Umirzoqov Pardamurod Akbar O‘g‘li"": ""👍👍👍👍"", ""Zokirjon Isroilov Zoxidjon O‘g‘li"": ""Assalomu alekum Telefon ishlashida Muomo Yuq Lekin Zaryadka ketishi Tez ekan 100% 4 5soatga yetayapti"", ""Ranoxon Akbarova Mambetovna"": ""спасибо быстро"", ""Jamshid Baltabayev"": ""18 oyga qancha"", ""Dilshodbek"": ""зор"", ""Тимур Каримджанов"": ""телефон работает хорошо четко очень шустрый очень удобный не большой мне нравиться но обманули с характеристиками это процессор и связь написано что стоит Dimensity процессор но стоит helio g100 и он не поддерживает 5G ну я на это закрыл глаза то что аппарат хорош и редми немного стали лучше""}","{""Вес"": ""204 г"", ""Цвет"": ""Чёрный"", ""Размер"": ""161.2 x 74.2 x 8 ШхВхТ"", ""Диагональ экрана"": ""6.67\"""", ""Тип экрана"": ""AMOLED"", ""Версия ОС"": ""Android 14"", ""Коммуникации"": ""BDSGPSNFCA-GPSWi-FiGALILEOGLONASSBluetooth"", ""Форм-фактор"": ""Моноблок"", ""Особенности"": ""4GBluetoothС камеройС фонарикомС большим экраномС мощной батареей"", ""Стандарт Wi-Fi"": ""Wi-Fi 6 (802.11 a/b/g/n/ac/6)."", ""Тип SIM-карты"": ""Nano SIM"", ""Модель"": ""Xiaomi Redmi Note 14 Pro"", ""Стандарт связи"": ""3G4G"", ""Видеопроцессор"": ""Mali-G68 MC4"", ""Гарантийный срок"": ""1 год"", ""Основная камера"": ""200 МП"", ""Разрешение фронтальной камеры"": ""16 МП"", ""Выход на наушники"": ""USB-C адаптер"", ""Встроенная память"": ""256 ГБ"", ""Оперативная память"": ""8 ГБ"", ""Процессор"": ""MediaTek Helio G100 Ultra"", ""Количество SIM-карт"": ""2"", ""Особенности смартфон"": ""С фонарикомНа 2 сим картыС быстрой зарядкойС разблокировкой по лицуСо сканером отпечатка пальцев"", ""Макс. разрешение видео"": ""4K"", ""Страна происхождения"": ""Китай"", ""Количество основных (тыловых) камер"": ""3"", ""Слот для карт памяти"": ""гибридным слотом для SIM-карт"", ""Беспроводные интерфейсы"": ""Wi-Fi 6 (802.11 a/b/g/n/ac/6)/Bluetooth 5.2/NFC//GPS, A-GPS, GLONASS, GALILEO, BDS"", ""Емкость аккумулятора"": ""5110мАч"", ""Основные (тыловые) камеры"": ""200 МП"", ""Частота кадров при записи видео 4K"": ""30 fps"", ""Поддержка диапазонов LTE"": ""LTE FDD/LTE TDD"", ""Макс. частота кадров видео"": ""60 fps"", ""Количество ядер процессора"": ""8 ядер"", ""Точный объём аккумулятора"": ""5500 мАч"", ""Частота кадров при записи видео Full HD"": ""Full HD (1080p)"", ""Операционная система"": ""Android""}",https://asaxiy.uz/product/smartfon-xiaomi-redmi-note-14-pro-8256gb-midnight-black
