name,image,attribute,new_price,old_price,discount,installment,stars,count,r_count,reviews,characteristics,link
Ноутбук Apple MacBook Air 13 M2 8GB/256GB Midnight,https://cdn.asaxiy.uz/asaxiy-content/product/main_image/desktop/63329b2850bd3.png.webp,ТОП,10869000,Unavailable,No discount,1 304 300 сум x 12 мес,5,В наличии,6,"{"""": ""quvvati nechi soatga yetadi?""}","{""Объем ОЗУ"": ""8 ГБ"", ""Вес"": ""1.24 кг"", ""Тип накопителя"": ""SSD"", ""Класс"": ""Для офисаДля учебыДля бизнесаДля графикиДля геймеровУниверсальныеДля программирования"", ""Размер"": ""1.13 x 30.41 x 21.5 см"", ""Бренд графического процессора"": ""8-ядерный графический процессор"", ""Картридер"": ""без кардридер"", ""Количество ядер процессора"": ""8"", ""Тип матрицы"": ""Liquid Retina"", ""Видеокарта"": ""Apple graphics 8-core"", ""Диагональ экрана"": ""13\"""", ""Тип устройства"": ""Ноутбук"", ""Время автономной работы"": ""До 15 часов беспроводного интернета"", ""Покрытие экрана"": ""13,6 дюйма и светодиодной подсветкой, технологией IPS; собственное разрешение 2560x1664 при плотности 224 пикселей на дюйм Яркость 500 нит"", ""Гарантийный срок"": ""1 год"", ""Материал корпуса"": ""Металл"", ""Бренд процессора"": ""Apple"", ""Число портов USB"": ""Порт зарядки MagSafe 3 // 3,5 мм разъем для наушников // Два порта Thunderbolt/USB 4"", ""Модуль связи WiFi"": ""Wi-Fi 6 (802.11ax)+ Bluetooth 5.3"", ""Разрешение экрана"": ""больше Full HD"", ""Серия процессора"": ""Apple M2"", ""Число портов HDMI"": ""без HDMI"", ""Оптический привод DVD"": ""нет"", ""Емкость аккумулятора"": ""Литий-полимерный аккумулятор емкостью 52,6 Вт‑ч"", ""Интерфейсы и разъемы"": ""3.5 мм"", ""Подсветка клавиатуры"": ""Да"", ""Технология матрицы"": ""IPS"", ""Предустановленная ОС"": ""Mac OS"", ""Особенности ноутбуков"": ""МиниМощныеКомпактныеС подсветкой клавиатуры"", ""Модуль связи Bluetooth"": ""Есть"", ""Разрешение Web-камеры"": ""HD-камера FaceTime 1080p"", ""Объем накопителя (HDD/SSD)"": ""256 GB"", ""Производитель видеокарты"": ""Apple"", ""Тип оперативной памяти"": ""LPDDR5"", ""Частота обновления экрана"": ""60 Гц""}",https://asaxiy.uz/product/noutbuk-apple-macbook-air-13-m2-8gb256gb-midnight-starlight-space-gray-silver
Планшет Samsung Galaxy Tab A9 4/64GB Серый,https://cdn.asaxiy.uz/asaxiy-content/product/main_image/desktop/656b32b42c4b6.png.webp,Скидка,1819000,2585000,30,218 300 сум x 12 мес,5,В наличии,2,"{""ᴍʀ.ᴄʜɪᴄᴀɢᴏ™"": ""Отличный планшет 😍"", ""Ирина -Тарабаева"": ""Супер быстро отправили""}","{""Вес"": ""333 г"", ""Цвет"": ""Серые"", ""Размер"": ""211 × 124.7 × 8 мм"", ""Класс"": ""ИгровыеДля детейДля учебыДля чтенияУниверсальные"", ""Камера"": ""8МП"", ""Особенности"": ""С камеройС компасомС гироскопомС быстрой зарядкой"", ""Тип матрицы"": ""TFT"", ""Гарантийный срок"": ""1 год"", ""Диагональ экрана"": ""8.7\"""", ""Разрешение экрана"": ""1340x800"", ""Встроенная память"": ""64 ГБ"", ""Оперативная память"": ""4 ГБ"", ""Количество SIM-карт"": ""1"", ""Операционная система"": ""Android"", ""Беспроводные технологии"": ""2G3GGPSWi-FiBeiDouGALILEOGLONASS4G (LTE)""}",https://asaxiy.uz/product/planshet-samsung-galaxy-tab-a9-464gb-seryy-2
Смартфон Xiaomi Redmi Note 14 Pro 8/256GB Midnight Black,https://cdn.asaxiy.uz/asaxiy-content/product/main_image/desktop/6787ad7fdf19d.jpg.webp,Супер цена,3339000,3919000,15,406 300 сум x 12 мес,4,В наличии,7,"{""Tojiqulov Minavvar Muhiddin O‘g‘li"": ""buni kim hal qiladi"", ""Umirzoqov Pardamurod Akbar O‘g‘li"": ""👍👍👍👍"", ""Zokirjon Isroilov Zoxidjon O‘g‘li"": ""Assalomu alekum Telefon ishlashida Muomo Yuq Lekin Zaryadka ketishi Tez ekan 100% 4 5soatga yetayapti"", ""Ranoxon Akbarova Mambetovna"": ""спасибо быстро"", ""Jamshid Baltabayev"": ""18 oyga qancha"", ""Dilshodbek"": ""зор"", ""Тимур Каримджанов"": ""телефон работает хорошо четко очень шустрый очень удобный не большой мне нравиться но обманули с характеристиками это процессор и связь написано что стоит Dimensity процессор но стоит helio g100 и он не поддерживает 5G ну я на это закрыл глаза то что аппарат хорош и редми немного стали лучше""}","{""Вес"": ""204 г"", ""Цвет"": ""Чёрный"", ""Размер"": ""161.2 x 74.2 x 8 ШхВхТ"", ""Диагональ экрана"": ""6.67\"""", ""Тип экрана"": ""AMOLED"", ""Версия ОС"": ""Android 14"", ""Коммуникации"": ""BDSGPSNFCA-GPSWi-FiGALILEOGLONASSBluetooth"", ""Форм-фактор"": ""Моноблок"", ""Особенности"": ""4GBluetoothС камеройС фонарикомС большим экраномС мощной батареей"", ""Стандарт Wi-Fi"": ""Wi-Fi 6 (802.11 a/b/g/n/ac/6)."", ""Тип SIM-карты"": ""Nano SIM"", ""Модель"": ""Xiaomi Redmi Note 14 Pro"", ""Стандарт связи"": ""3G4G"", ""Видеопроцессор"": ""Mali-G68 MC4"", ""Гарантийный срок"": ""1 год"", ""Основная камера"": ""200 МП"", ""Разрешение фронтальной камеры"": ""16 МП"", ""Выход на наушники"": ""USB-C адаптер"", ""Встроенная память"": ""256 ГБ"", ""Оперативная память"": ""8 ГБ"", ""Процессор"": ""MediaTek Helio G100 Ultra"", ""Количество SIM-карт"": ""2"", ""Особенности смартфон"": ""С фонарикомНа 2 сим картыС быстрой зарядкойС разблокировкой по лицуСо сканером отпечатка пальцев"", ""Макс. разрешение видео"": ""4K"", ""Страна происхождения"": ""Китай"", ""Количество основных (тыловых) камер"": ""3"", ""Слот для карт памяти"": ""гибридным слотом для SIM-карт"", ""Беспроводные интерфейсы"": ""Wi-Fi 6 (802.11 a/b/g/n/ac/6)/Bluetooth 5.2/NFC//GPS, A-GPS, GLONASS, GALILEO, BDS"", ""Емкость аккумулятора"": ""5110мАч"", ""Основные (тыловые) камеры"": ""200 МП"", ""Частота кадров при записи видео 4K"": ""30 fps"", ""Поддержка диапазонов LTE"": ""LTE FDD/LTE TDD"", ""Макс. частота кадров видео"": ""60 fps"", ""Количество ядер процессора"": ""8 ядер"", ""Точный объём аккумулятора"": ""5500 мАч"", ""Частота кадров при записи видео Full HD"": ""Full HD (1080p)"", ""Операционная система"": ""Android""}",https://asaxiy.uz/product/smartfon-xiaomi-redmi-note-14-pro-8256gb-midnight-black
ТВ приставка Xiaomi Mi Box TV S 4K 2nd GEN (Global Version),https://cdn.asaxiy.uz/asaxiy-content/product/main_image/desktop/5f8af7e0a6844.png.webp,Скидка,779000,829000,7,216 200 сум x 4 мес,5,В наличии,16,"{""Dilmurod Alimjanov"": ""Zor ishlayapti"", ""Asilbek Erkinov Erkin O‘g‘li"": ""Buni bekor qiling adashib 2ta buyurtma beerib yuboribman"", ""Akbarov G‘anisher G‘ayrat O‘g‘li"": ""Zur ekan"", ""Sanjar Saydullayev Soatjon O‘g‘li"": ""pairing qila olmayapman, instruktsiyada ko'rsatilgan 2 ta tugmani bosib tursam ulanmayapti. nima qilishim kk? mahsulotni almashtirsam bo'ladimi?"", ""Madinabonu Muxamadjonova"": ""ajoyib tavsiya qilaman"", ""Farrux Rahmanov"": ""Juda yaxshi smart box. Kutganimdan xam a'lo.  Narxi xam boshqalarnikidan arzonroq. Raxmat asaxiy uzga."", ""Юсупов Муродбек"": ""зур аппарат"", ""Ismoilov Isroil Xxx"": ""зур гап йук"", ""Axmadov Ilxomjon Izzatilla-O‘g‘li"": ""buni smart pulti ichida keladimi yoki alohida olish kerakmi. google assistent ishlaydimi"", ""Namozov Abrorjon Akmaljon O‘g‘li"": ""Juda yaxshi mahsulot ekan"", ""Solayjon Olimov Ravshanbek O‘g‘li"": ""Mahsulotning sifati zòr,narxiyam eng arzoni asaxiyda menimcha."", ""Sanjar Sattarov Sodiqovich"": ""8 138 649 000 сум, LMOA :)"", ""Hasanxonov Aloxon Saidnosir O'g'li"": ""Zo’r"", ""Mirkamol"": ""Очень хорошая ТВ-бокс с железом андроид. Единственный минус - это его цена"", ""Сергей"": ""Бралась для подключения к старому телевизору без Смарт ТВ. Получил то что хотел - просмотр фильмов с внешнего диска и ютуб без подключения к компу.\r\nУправление удобное, дизайн стильный.""}","{""Вес"": ""0.142 кг"", ""Размер"": ""95.25 x 95.25 x 16.7 мм"", ""Гарантийный срок"": ""6 месяцев"", ""Страна происхождения"": ""Китай""}",https://asaxiy.uz/product/smart-tv-pristavka-mi-box-tv
Смартфон Samsung Galaxy A56 5G 8/256 Awesome Graphite,https://cdn.asaxiy.uz/asaxiy-content/product/main_image/desktop/67d972d4131e2.jpg.webp,Супер цена,5039000,5499000,9,613 100 сум x 12 мес,5,В наличии,3,"{""ᴍʀ.ᴄʜɪᴄᴀɢᴏ™"": ""Отличный смартфон, рекомендую"", ""Jahongir Shirinov Ilhom O‘g‘li"": ""yaxwi""}","{""Вес"": ""213 г"", ""Аудио"": ""MP3, M4A, 3GA, AAC, OGG, OGA, WAV, AMR, AWB, FLAC, MID, MIDI, XMF, MXMF, IMY, RTTTL, RTX, OTA"", ""Видео"": ""UHD 4K (3840 x 2160) для 60 кадров в секунду"", ""Размер"": ""161.1 x 77.4 x 8.2 ВхШхТ"", ""Диагональ экрана"": ""6.7\"""", ""Тип экрана"": ""Super AMOLED"", ""Версия ОС"": ""android"", ""Коммуникации"": ""GPSNFCQZSSWi-FiGALILEOGLONASSBluetooth"", ""Цвет"": ""Чёрный"", ""Форм-фактор"": ""Моноблок"", ""Особенности"": ""4GBluetoothС камеройС фонарикомС большим экраномС мощной батареей"", ""Стандарт Wi-Fi"": ""802.11a/b/g/n/ac/ax 2.4ГГц+5ГГц, HE80, MIMO, 1024-QAM"", ""Тип SIM-карты"": ""nano sim"", ""Модель"": ""Samsung Galaxy A56"", ""Стандарт связи"": ""4G5G"", ""Гарантийный срок"": ""1 год"", ""Основная камера"": ""50+12+5 Мп"", ""Разрешение фронтальной камеры"": ""12МП"", ""Выход на наушники"": ""USB Type-C"", ""Встроенная память"": ""256 ГБ"", ""Оперативная память"": ""8 ГБ"", ""Процессор"": ""Samsung Exynos 1580"", ""Количество SIM-карт"": ""2"", ""Особенности смартфон"": ""С компасомС фонарикомНа 2 сим картыС тройной камеройС разблокировкой по лицуСо сканером отпечатка пальцев"", ""Макс. разрешение видео"": ""3840x2160"", ""Количество основных (тыловых) камер"": ""3"", ""Слот для карт памяти"": ""есть"", ""Беспроводные интерфейсы"": ""Bluetooth, NFC, Wi-Fi"", ""Емкость аккумулятора"": ""5000 мА*ч"", ""Основные (тыловые) камеры"": ""50МП"", ""Частота кадров при записи видео 4K"": ""30 fps"", ""Поддержка диапазонов LTE"": ""3G, 4G LTE"", ""Макс. частота кадров видео"": ""30 fps"", ""Количество ядер процессора"": ""8"", ""Точный объём аккумулятора"": ""5000 мА⋅ч"", ""Частота кадров при записи видео Full HD"": ""UHD 4K (3840 x 2160) для 60 кадров в секунду"", ""Операционная система"": ""Android""}",https://asaxiy.uz/product/smartfon-samsung-galaxy-a56-5g-8256-awesome-graphite
Телевизор Moonx 43M850 Android TV,https://cdn.asaxiy.uz/asaxiy-content/product/main_image/desktop/6766c7ef2c5f0.jpg.webp,Скидка,2139000,2469000,14,256 700 сум x 12 мес,5,В наличии,0,{},"{""Вес"": ""6.6кг"", ""Диагональ"": ""43\"""", ""Разрешение экрана"": ""Full HD (1920x1080)"", ""Тип телевизора"": ""LED"", ""Гарантийный срок"": ""1 год"", ""Операционная система"": ""Android TV"", ""Страна происхождения"": ""Узбекистан"", ""Технологии"": ""WiFiSmart TV"", ""Назначение"": ""В гостиную""}",https://asaxiy.uz/product/televizor-moonx-43ah850-android-tv
Дунё даҳолари (китоблар тўплами),https://cdn.asaxiy.uz/asaxiy-content/product/main_image/desktop/671d15e0331aa.jpeg.webp,Скидка,199000,249000,21,55 300 сум x 4 мес,5,В наличии,5,"{""Maftuna Xolto‘rayeva"": ""Juda foydali va qiziq kitoblar ekan . Singlimga olgandim . Qoʻlidan qoʻymay oʻqiyapti. Oʻzim ham qiziqib qoldim. Toʻplam qilib olishni maslahat beraman. Rahmat"", ""Aliyev Durbek Oybek O‘g‘li"": ""zur kitoblar ekan"", ""Shukurullo Musurmonov"": ""Assalomu alaykum. Biz kitob chiqaramiz. Tverdiy va myaxkiy. Shartnoma qila olamizmi siz bilan?"", ""Oyshakar Ungarova"": ""Assalomu alaykum, kitoblar juda qiziqligi sharhlardan ma'lum, farzandlarimizga o'qib beramiz, albatta..."", ""Рахматилла Саломуллаев"": ""rus tilida ham nashri bo'ladimi?""}",{},https://asaxiy.uz/product/dunyo-daholari
Смартфон iPhone 16 Pro Max eSim 256GB Desert Titanium,https://cdn.asaxiy.uz/asaxiy-content/product/main_image/desktop/66eeb4d440ffe.webp,ТОП,17179000,Unavailable,No discount,2 090 200 сум x 12 мес,5,В наличии,0,{},"{""Вес"": ""227 г"", ""Аудио"": ""AAC, APAC, MP3, Apple Lossless, FLAC, Dolby Digital, Dolby Digital Plus и Dolby Atmos."", ""Видео"": ""HEVC, H.264, AV1 и ProRes. HDR с Dolby Vision, HDR10+/HDR10 и HLG"", ""Размер"": ""163*77.6*8.25 мм"", ""Диагональ экрана"": ""6,9"", ""Тип экрана"": ""Super Retina XDR"", ""Версия ОС"": ""iOS 18"", ""Коммуникации"": ""GPSQZSSNavICWi-FiBeidouGALILEOGLONASSiBeaconBluetooth"", ""Цвет"": ""Золотистый"", ""Форм-фактор"": ""Моноблок"", ""Особенности"": ""4GBluetoothС камеройС фонарикомС большим экраном"", ""Стандарт Wi-Fi"": ""802.11ax"", ""Тип SIM-карты"": ""eSim"", ""Модель"": ""iPhone 16 Pro Max"", ""Стандарт связи"": ""3G4G5G"", ""Видеопроцессор"": ""Neural Engine"", ""Гарантийный срок"": ""1 год"", ""Разрешение фронтальной камеры"": ""12 МП"", ""Выход на наушники"": ""USB Type-C"", ""Процессор"": ""Apple A18 Pro"", ""Количество SIM-карт"": ""1"", ""Особенности смартфон"": ""С e-simИгровыеС фонарикомС барометромС гироскопомС автофокусомC макрообъективомС тройной камеройВодонепроницаемыеС беспроводной зарядкойС разблокировкой по лицуС широкоугольным объективомС ультраширокоугольным объективом"", ""Встроенная память"": ""256 ГБ"", ""Макс. разрешение видео"": ""1320 x 2868"", ""Количество основных (тыловых) камер"": ""3"", ""Слот для карт памяти"": ""нет"", ""Беспроводные интерфейсы"": ""bluetooth, nfc, wi-fi"", ""Емкость аккумулятора"": ""3355 мАч"", ""Основные (тыловые) камеры"": ""48 МП + 12МП + 48 МП"", ""Частота кадров при записи видео 4K"": ""24/25/30/60 кадров в секунду"", ""Поддержка диапазонов LTE"": ""2G/3G/4G LTE/5G"", ""Количество ядер процессора"": ""6"", ""Точный объём аккумулятора"": ""3355 мАч"", ""Частота кадров при записи видео Full HD"": ""25/30/60 кадров в секунду"", ""Операционная система"": ""iOS""}",https://asaxiy.uz/product/smartfon-iphone-16-pro-max-e-sim-256gb-desert-titanium
"Умные часы HUAWEI Watch Fit 4 pro, Black",https://cdn.asaxiy.uz/asaxiy-content/product/main_image/desktop/686270b263bf2.png.webp,ТОП,2439000,Unavailable,No discount,292 700 сум x 12 мес,5,В наличии,0,{},"{""Вес"": ""30.4 г"", ""Форма"": ""Круглые"", ""Размер"": ""44.5х40х9.3"", ""Категория"": ""ЖенскиеМужскиеУниверсальные"", ""Назначение"": ""Для бегаСпортивныеДля фитнеса"", ""Совместимость"": ""Android и IOS"", ""Тип экрана"": ""Цветной  AMOLED"", ""Цвет ремешка"": ""Черный"", ""Диагональ экрана"": ""1.82"", ""Гарантийный срок"": ""6 месяцев"", ""Основные функции"": ""SMS сообщенияС барометромС пульсометромС секундомеромС функцией звонкаВстроенный микрофонДинамик (громкая связь)"", ""Размер экрана, мм"": ""48"", ""Материал ремешка"": ""С металлическим браслетом"", ""Материал корпуса"": ""АлюминийНержавеющая сталь"", ""Разрешение экрана"": ""480х408"", ""Емкость аккумулятора"": ""400 мА·ч"", ""Страна происхождения"": ""Китай"", ""Беспроводные технологии"": ""Bluetooth""}",https://asaxiy.uz/product/umnye-chasy-huawei-watch-fit-4-pro-black
Смартфон Samsung Galaxy S25 Ultra 12/256 ГБ Titanium Silverblue,https://cdn.asaxiy.uz/asaxiy-content/product/main_image/desktop/67933cd159d5c.png.webp,ТОП,15339000,Unavailable,No discount,1 866 300 сум x 12 мес,5,В наличии,0,{},"{""Вес"": ""218 г"", ""Аудио"": ""3GA, AAC, AMR, APE, AWB, DFF, DSF, FLAC, IMY, M4A, MID, MIDI, MP3, MXMF, OGA, OGG, OTA, RTTTL, RTX, WAV, XMF"", ""Видео"": ""MP4, M4V, 3GP, 3G2, AVI, FLV, MKV, WEBM"", ""Цвет"": ""Синий"", ""Размер"": ""162,8 x 77,6 x 8,2"", ""Диагональ экрана"": ""6.9\"""", ""Тип экрана"": ""Dynamic AMOLED 2X"", ""Версия ОС"": ""Android 15 с One UI 7"", ""Коммуникации"": ""GPSNFCQZSSA-GPSWi-FiBeidouGALILEOGLONASSiBeaconBluetooth"", ""Форм-фактор"": ""Моноблок"", ""Изображения"": ""2992x2992, 4000x1848, 4000x2250, 4000x3000, 8160x6120, 16320x12240"", ""Особенности"": ""4GBluetoothС камеройС большим экраномС мощной батареей"", ""Стандарт Wi-Fi"": ""Wi-Fi Direct, Wi-Fi Hotspot"", ""Тип SIM-карты"": ""Nano-SIM, eSIM"", ""Модель"": ""Samsung Galaxy S25 Ultra"", ""Стандарт связи"": ""3G4G5G"", ""Видеопроцессор"": ""AI ProVisual Engine"", ""Гарантийный срок"": ""1 год"", ""Основная камера"": ""200+50+50+10 Мп"", ""Разрешение фронтальной камеры"": ""12 МП"", ""Выход на наушники"": ""USB Type-C"", ""Встроенная память"": ""256 ГБ"", ""Оперативная память"": ""12 ГБ"", ""Процессор"": ""Qualcomm Snapdragon 8 Elite for Galaxy"", ""Количество SIM-карт"": ""2"", ""Особенности смартфон"": ""С e-simИгровыеС компасомС барометромС гироскопомНа 2 сим картыЧетыре камерыВодонепроницаемыеС быстрой зарядкойС реверсивной зарядкойС беспроводной зарядкойС разблокировкой по лицуС цифровой стабилизациейС широкоугольным объективомСо сканером отпечатка пальцевС ультраширокоугольным объективом"", ""Макс. разрешение видео"": ""Full HD, HD, Ultra HD 4K, Ultra HD 8K"", ""Страна происхождения"": ""Вьетнам"", ""Количество основных (тыловых) камер"": ""4"", ""Слот для карт памяти"": ""нет"", ""Емкость аккумулятора"": ""5000 мА*ч"", ""Основные (тыловые) камеры"": ""200+50+50+10 Мп"", ""Поддержка диапазонов LTE"": ""FDD-LTE 700 (B12), FDD-LTE 700 (B13), FDD-LTE 700 (B17), FDD-LTE 700 (B28), FDD-LTE 800 (B20), FDD-LTE 850 (B5), FDD-LTE 850 (B18), FDD-LTE 850 (B19), FDD-LTE 850 (B26), FDD-LTE 900 (B8), FDD-LTE 1700 (B4), FDD-LTE 1700 (B66), FDD-LTE 1800 (B3), FDD-LTE 1900 (B2), FDD-LTE 1900 (B25), FDD-LTE 2100 (B1), FDD-LTE 2600 (B7), TDD-LTE 1900 (B39), TDD-LTE 2300 (B40), TDD-LTE 2500 (B41), TDD-LTE 2600 (B38)"", ""Макс. частота кадров видео"": ""1280x720 (30 кадр./сек.), 1920x1080 (30 кадр./сек.), 1920x1080 (60 кадр./сек.), 1920x1080 (120 кадр./сек.), 1920x1080 (240 кадр./сек.), 3840x2160 (30 кадр./сек.), 3840x2160 (60 кадр./сек.), 3840x2160 (120 кадр./сек.), 7680x4320 (30 кадр./сек.)"", ""Количество ядер процессора"": ""8"", ""Точный объём аккумулятора"": ""5000 мА*ч"", ""Операционная система"": ""Android""}",https://asaxiy.uz/product/samsung-galaxy-s25-ultra-256-gb-siniy-titan
